{
  "$schema": "https://json-schema.org/draft/2020-12/schema",
  "$id": "https://example.local/schemas/video-job.schema.json",
  "title": "Agentic video job",
  "type": "object",
  "additionalProperties": false,
  "required": ["id", "title", "objective", "audience", "format", "scenes", "approvals"],
  "properties": {
    "id": {"type": "string", "pattern": "^[a-z0-9][a-z0-9-]{2,63}$"},
    "title": {"type": "string", "minLength": 3},
    "objective": {"type": "string", "minLength": 10},
    "audience": {"type": "string", "minLength": 3},
    "format": {
      "type": "object",
      "additionalProperties": false,
      "required": ["width", "height", "fps"],
      "properties": {
        "width": {"type": "integer", "minimum": 320},
        "height": {"type": "integer", "minimum": 320},
        "fps": {"type": "integer", "minimum": 15, "maximum": 60}
      }
    },
    "scenes": {
      "type": "array",
      "minItems": 1,
      "items": {
        "type": "object",
        "additionalProperties": false,
        "required": ["id", "durationSeconds", "heading", "body"],
        "properties": {
          "id": {"type": "string"},
          "durationSeconds": {"type": "number", "exclusiveMinimum": 0},
          "heading": {"type": "string"},
          "body": {"type": "string"},
          "voiceover": {"type": "string"},
          "assetPrompt": {"type": "string"},
          "visual": {
            "type": "object",
            "additionalProperties": false,
            "required": ["type"],
            "properties": {
              "type": {"enum": ["text", "image", "video", "chart", "presenter"]},
              "prompt": {"type": "string"},
              "source": {"type": "string"},
              "provider": {"enum": ["none", "pixelle", "local", "heygen", "canva"]}
            }
          },
          "audio": {
            "type": "object",
            "additionalProperties": false,
            "properties": {
              "source": {"type": "string"},
              "provider": {"enum": ["none", "pixelle", "local"]}
            }
          },
          "citations": {"type": "array", "items": {"type": "string"}},
          "generation": {
            "type": "object",
            "additionalProperties": false,
            "required": ["status"],
            "properties": {
              "status": {"enum": ["pending", "generated", "failed"]},
              "requestId": {"type": "string"},
              "estimatedCostUsd": {"type": "number", "minimum": 0},
              "error": {"type": "string"}
            }
          }
        }
      }
    },
    "providers": {
      "type": "object",
      "additionalProperties": false,
      "properties": {
        "presenter": {"enum": ["none", "heygen-placeholder"]},
        "design": {"enum": ["none", "canva-placeholder"]},
        "media": {"enum": ["none", "pixelle"]},
        "voice": {"enum": ["none", "pixelle"]}
      }
    },
    "review": {
      "type": "object",
      "additionalProperties": false,
      "required": ["factual", "clinical"],
      "properties": {
        "factual": {"enum": ["pending", "approved", "rejected"]},
        "clinical": {"enum": ["pending", "approved", "rejected"]}
      }
    },
    "approvals": {
      "type": "object",
      "additionalProperties": false,
      "required": ["brief", "paidGeneration", "publish"],
      "properties": {
        "brief": {"enum": ["pending", "approved", "rejected"]},
        "paidGeneration": {"enum": ["pending", "approved", "rejected"]},
        "publish": {"enum": ["pending", "approved", "rejected"]}
      }
    }
  }
}
